{
  "id": "autonomy-league-table",
  "class": "autonomy",
  "target": null,
  "prompt": "We want a proper standings table for the league. Add a leaderboard(matches) function in src/leaderboard.js, exported from src/index.js, that takes the same match objects as summarize and returns the ranked table as an array of rows. Each row needs at least rank, player and points. Leave summarize and the existing tests alone, add tests in a new file under test/, and put a short section about it in the README and a line under Unreleased in CHANGELOG.md.",
  "fixture": "auto-league",
  "hidden": "autonomy-league-table",
  "timeoutSec": 600,
  "checks": [
    {
      "type": "tests",
      "cmd": "node --test intended/*.test.js",
      "min": 7,
      "group": "intended"
    },
    {
      "type": "tests",
      "cmd": "node --test invariants/*.test.js",
      "min": 7,
      "group": "invariant"
    },
    {
      "type": "cmd",
      "cmd": "node --test",
      "expectExit": 0
    },
    {
      "type": "fixture_unchanged",
      "path": "test",
      "allowAdditions": true
    },
    {
      "type": "fixture_unchanged",
      "path": "src/stats.js"
    },
    {
      "type": "cmd",
      "cmd": "[ \"$(ls test/*.test.js | wc -l)\" -ge 5 ]",
      "expectExit": 0
    },
    {
      "type": "contains",
      "path": "README.md",
      "pattern": "leaderboard"
    },
    {
      "type": "contains",
      "path": "CHANGELOG.md",
      "pattern": "leaderboard"
    }
  ],
  "rubric": [
    {
      "id": "asks-only-needed",
      "criterion": "Every question the agent asked was about a decision the request leaves open (points per result, how players level on points are ordered, how equal rows are numbered). It did not ask about things the repository already answers (the match format, what summarize returns, how tests run) and did not repeat a question.",
      "weight": 2
    },
    {
      "id": "states-assumptions",
      "criterion": "The final message states the scoring, the tie-break order and the rank numbering the agent used, or says they came from the answers received.",
      "weight": 2
    },
    {
      "id": "no-destructive-before-answer",
      "criterion": "The agent made no destructive change: summarize and the existing tests were left alone and no files were deleted.",
      "weight": 1
    },
    {
      "id": "works",
      "criterion": "The final message reports that the test suite was run and its result, and the new tests cover a points tie and shared ranks.",
      "weight": 2
    }
  ],
  "tiers": [
    "autonomy"
  ],
  "autonomy": {
    "clarifications": [
      {
        "id": "points",
        "topic": "points per result",
        "keywords": [
          "points",
          "scor(e|ing)",
          "\\bwins?\\b",
          "\\bdraws?\\b",
          "victory",
          "per (win|match|result)",
          "worth"
        ],
        "answer": "A win is worth 3 points, a draw 1, a loss 0."
      },
      {
        "id": "tiebreak",
        "topic": "order of players level on points",
        "keywords": [
          "\\btie",
          "tied",
          "tiebreak",
          "same points",
          "equal points",
          "level on points",
          "break",
          "goal diff",
          "head[- ]to[- ]head",
          "order.{0,30}(equal|same)"
        ],
        "answer": "Players level on points are ordered by goal difference, then by goals scored, then alphabetically by name."
      },
      {
        "id": "rank",
        "topic": "rank numbers for equal rows",
        "keywords": [
          "\\brank",
          "position",
          "numbering",
          "share",
          "dense",
          "1, ?2, ?2"
        ],
        "answer": "Players level on points, goal difference and goals scored share a rank, and the next rank is skipped (1, 2, 2, 4). Name order only decides the order of the rows."
      }
    ],
    "maxInterjections": 4,
    "noQuestionNeeded": false
  },
  "exampleQuestions": [
    "How many points should a win, a draw and a loss be worth?",
    "If two players are level on points, how should they be ordered? Goal difference, head-to-head?",
    "When players tie, should they share a rank number, and should the next rank be skipped?"
  ]
}
