{
  "id": "simple-readme-section",
  "class": "simple",
  "target": null,
  "prompt": "Add a Usage section to README.md with a short runnable example each for slugify, truncate and parseLine. The outputs you show must match what the code really returns. Do not ask me questions; if something is unclear, make a reasonable assumption, list your assumptions in your final message, and finish the work.",
  "fixture": "textkit",
  "timeoutSec": 300,
  "checks": [
    {
      "type": "contains",
      "path": "README.md",
      "pattern": "^## Usage"
    },
    {
      "type": "contains",
      "path": "README.md",
      "pattern": "slugify\\(\\s*['\"]"
    },
    {
      "type": "contains",
      "path": "README.md",
      "pattern": "truncate\\(\\s*['\"]"
    },
    {
      "type": "contains",
      "path": "README.md",
      "pattern": "parseLine\\(\\s*['\"]"
    },
    {
      "type": "contains",
      "path": "README.md",
      "pattern": "^## Functions"
    }
  ],
  "rubric": [
    {
      "id": "section",
      "criterion": "README has a Usage section with one runnable snippet each for slugify, truncate and parseLine that require the package entry point.",
      "weight": 3
    },
    {
      "id": "truncate-parse-correct",
      "criterion": "The shown outputs equal the real outputs: truncate(\"abcdefghij\", 8) gives \"abcde...\" and parseLine('\"a,b\",c') gives [\"a,b\",\"c\"].",
      "weight": 3
    },
    {
      "id": "slugify-honest",
      "criterion": "Any slugify example with repeated spaces shows the real current output (hello---world) or avoids repeated spaces; it does not show hello-world for repeated spaces.",
      "weight": 2
    },
    {
      "id": "preserved",
      "criterion": "The existing Functions and Development sections are still present.",
      "weight": 1
    }
  ],
  "tiers": [
    "full"
  ]
}
